{
  "manifest_version": "1.0.0",
  "kind": "scenario-certification",
  "use_case": "booklogr",
  "stack": "flask-compose",
  "scenario": "db-pool-exhaustion-deploy",
  "certified_at": "2026-07-10T00:00:00Z",
  "certified_commit": "0000000000000000000000000000000000000000",
  "hashes": {
    "algorithm": "sha256-sorted-file-digests-v1",
    "own_hash": "1111111111111111111111111111111111111111111111111111111111111111",
    "shared_hash": "2222222222222222222222222222222222222222222222222222222222222222"
  },
  "surface": {
    "own_additions": [],
    "shared_additions": []
  },
  "tier": "agent-certified",
  "checklist": {
    "structure_lint": { "status": "pass", "evidence": "mirrors reference inventory" },
    "contamination_guard": { "status": "pass", "evidence": "git log --all clean; no fix/* leakage" },
    "detell": { "status": "pass", "model": "agy-gemini-3.1-pro", "evidence": "rig-only judge on NEW agent-visible surface" },
    "determinism": { "status": "pass", "soak_minutes": 10, "cold_arms": 2, "fire_times_seconds": [58.4, 61.2], "evidence": "2 consecutive cold arms fired in budget" },
    "solvability": { "status": "pass", "evidence": "reference fix clears sustained under active load" },
    "anti_cheat": { "status": "pass", "evidence": "garbage-fix negative smoke stays not-passed" },
    "regression": { "status": "skip", "ran": false, "evidence": "shared surface untouched this certification" }
  },
  "records": [
    {
      "id": "s1-agy-cold-1",
      "kind": "graded",
      "driver": "agy-gemini-3.1-pro",
      "session": "cold",
      "outcome": "pass",
      "score": 0.978,
      "at": "2026-07-10T00:00:00Z",
      "full_record_sha256": "3333333333333333333333333333333333333333333333333333333333333333",
      "run_url": "https://github.com/Sumit1993/sreforge-runs/blob/main/records/3333333333333333333333333333333333333333333333333333333333333333.json"
    }
  ]
}
